{
  "version": 2,
  "revision": 1,
  "units": "m",
  "fixture": "boulevard",
  "settings": {
    "curb_height": 0.1524,
    "sidewalk_width": 3.2,
    "sample_spacing": 0.5,
    "show_guides": false
  },
  "boulevard": {
    "id": "boulevard-1",
    "length": 120,
    "lane_width": 3.66,
    "median_width": 7.5,
    "pocket_start": 30,
    "taper_length": 25,
    "pocket_end": 90,
    "median_material": "grass",
    "origin": [
      0,
      0,
      0
    ],
    "bearing": 0,
    "sample_spacing": 1,
    "median_end": 103,
    "nose_length": 5,
    "nose_shape": "rounded"
  },
  "crosswalks": []
}